,procedure,categorie,type_of_work,posting_time,reference,programmme,objet,acheteur_public,lieu_d_execution,date_close,time_close,action,industry
1092,AOO,Appel d'offres ouvert,Services,2022-01-17,53AOM/SNRT/2021,renouvellement et suivi de la certification de systeme de management de la sécurité de l'information de la SNRT selon la norme ISO/IEC 27001 version 2013,renouvellement et suivi de la certification de systeme de management de la sécurité de l'information de la SNRT selon la norme ISO/IEC 27001 version 2013,LA SOCIETE NATIONALE DE RADIODIFFUSION ET DE TELEVISION,RABAT,2022-02-15,15:00,https://www.marchespublics.gov.ma/?page=entreprise.EntrepriseDetailsConsultation&refConsultation=617906&orgAcronyme=x6c&code=&retraits,"Conseil, audit et assistance à maitrise d’ouvrage (à l’exception du domaine des nouvelles technologies)"
1093,AOO,Appel d'offres ouvert,Services,2022-01-14,05/2022/DPA/24/SAHA,Assistance technique liée aux travaux de création et d’aménagement de point d’eau dans la Zone d’Action de la DPA de Nador.,Assistance technique liée aux travaux de création et d’aménagement de point d’eau dans la Zone d’Action de la DPA de Nador.,DIRECTEUR PROVINCIAL D'AGRICULTURE NADOR,NADOR,2022-02-15,11:00,https://www.marchespublics.gov.ma/?page=entreprise.EntrepriseDetailsConsultation&refConsultation=617784&orgAcronyme=q1s&code=&retraits,"Conseil, audit et assistance à maitrise d’ouvrage (à l’exception du domaine des nouvelles technologies)"
1094,AOO,Appel d'offres ouvert,Services,2022-01-14,03/2022/DPA/24/SAHA,Assistance technique pour la supervision et le contrôle des travaux de réhabilitation des périmètres de Petite et Moyenne Hydraulique dans la Zone d’Action de la DPA de Nador: -Périmètres des communes Beni Sidel Jbel et,"Assistance technique pour la supervision et le contrôle des travaux de réhabilitation des périmètres de Petite et Moyenne Hydraulique dans la Zone d’Action de la DPA de Nador: -Périmètres des communes Beni Sidel Jbel et Beni Sidel Louta Cercle de Guelaia, Province de Nador .",DIRECTEUR PROVINCIAL D'AGRICULTURE NADOR,NADOR,2022-02-15,10:00,https://www.marchespublics.gov.ma/?page=entreprise.EntrepriseDetailsConsultation&refConsultation=617705&orgAcronyme=q1s&code=&retraits,"Conseil, audit et assistance à maitrise d’ouvrage (à l’exception du domaine des nouvelles technologies)"
1095,AOO,Appel d'offres ouvert,Services,2021-12-29,48/DAM/S/2021,PRESTATIONS D'INVENTAIRE RAPPROCHE DU PATRIMOINE DE L’ONEE-BRANCHE EAU,,,"TANGER-ASSILAH, MDIQ-FNIDEQ, TETOUAN, FAHS-ANJRA, LARACHE, AL HOCEIMA, CHEFCHAOUEN, OUEZZANE, OUJDA-ANGAD, NADOR, DRIOUCH, JERADA, BERKANE, TAOURIRT, GUERCIF, FIGUIG, FES, MEKNES, EL-HAJEB, IFRANE, MOULAY-YACOUB, SEFROU, BOULEMANE, TAOUNATE, TAZA, RABAT, SALE, SKHIRATE-TEMARA, KENITRA, KHEMISSET, SIDI KACEM, SIDI SLIMANE, BENI MELLAL, AZILAL, FQUIH BEN SALAH, KHENIFRA, KHOURIBGA, CASABLANCA, MOHAMMADIA, EL JADIDA, NOUACEUR, MEDIOUNA, BENSLIMANE, BERRECHID, SETTAT, SIDI BENNOUR, MARRAKECH, CHICHAOUA, AL HAOUZ, EL KELAA DES SRAGHNA, ESSAOUIRA, REHAMNA, SAFI, YOUSSOUFIA, ERRACHIDIA, OUARZAZATE, MIDELT, TINGHIR, ZAGORA, AGADIR IDA OU TANANE, INEZGANE-AIT MELLOUL, CHTOUKA-AIT BAHA, TAROUDANNT, TIZNIT, TATA, GUELMIM, ASSA-ZAG, TAN-TAN, SIDI IFNI, LAAYOUNE, BOUJDOUR, TARFAYA, ES-SEMARA, OUED ED DAHAB, AOUSSERD",2022-02-15,09:00,https://www.marchespublics.gov.ma/?page=entreprise.EntrepriseDetailsConsultation&refConsultation=615702&orgAcronyme=d4q&code=&retraits,"Conseil, audit et assistance à maitrise d’ouvrage (à l’exception du domaine des nouvelles technologies)"
1096,AOO,Appel d'offres ouvert,Services,2022-05-01,30/BP/2021,Assistance technique aux travaux de construction de la piste reliant la route nationale n°8 et Zaouiat Ben Sassi d’une longueur environ 4.5 km à la commune territoriale Ouled Hassoune à la préfecture de Marrakech,Assistance technique aux travaux de construction de la piste reliant la route nationale n°8 et Zaouiat Ben Sassi d’une longueur environ 4.5 km à la commune territoriale Ouled Hassoune à la préfecture de Marrakech,PREFECTURE de MARRAKECH,MARRAKECH,2022-10-02,10:30,https://www.marchespublics.gov.ma/?page=entreprise.EntrepriseDetailsConsultation&refConsultation=616879&orgAcronyme=j0w&code=&retraits,"Conseil, audit et assistance à maitrise d’ouvrage (à l’exception du domaine des nouvelles technologies)"
1097,AOO,Appel d'offres ouvert,Services,2022-01-13,02/2022/BP,REALISATION D’UNE ETUDE RELATIVE A L’ELABORATION DU PROGRAMME DE DEVELOPPEMENT DE LA PREFECTURE DE MARRAKECH  2022-2027,REALISATION D’UNE ETUDE RELATIVE A L’ELABORATION DU PROGRAMME DE DEVELOPPEMENT DE LA PREFECTURE DE MARRAKECH  2022-2027,PREFECTURE de MARRAKECH,MARRAKECH,2022-09-02,10:30,https://www.marchespublics.gov.ma/?page=entreprise.EntrepriseDetailsConsultation&refConsultation=617571&orgAcronyme=j0w&code=&retraits,"Conseil, audit et assistance à maitrise d’ouvrage (à l’exception du domaine des nouvelles technologies)"
1098,AOO,Appel d'offres ouvert,Services,2022-01-17,P0385/DVP,Prestations d’assistance à la commercialisation des plateaux bureaux adjacents à la gare de Casa ‎Port et du centre d’affaires de la zone logistique MITA.‎,Prestations d’assistance à la commercialisation des plateaux bureaux adjacents à la gare de Casa ‎Port et du centre d’affaires de la zone logistique MITA.‎,OFFICE NATIONAL DES CHEMINS DE FER,CASABLANCA,2022-09-02,09:00,https://www.marchespublics.gov.ma/?page=entreprise.EntrepriseDetailsConsultation&refConsultation=617951&orgAcronyme=o8p&code=&retraits,"Conseil, audit et assistance à maitrise d’ouvrage (à l’exception du domaine des nouvelles technologies)"
1099,AOO,Appel d'offres ouvert,Services,2022-01-14,01/AO/BOUREGREG/2022,"Audit financier des comptes sociaux et consolidés de l’Agence pour l’Aménagement de la Vallée de Bouregreg pour les exercices 2021, 2022 et 2023","Audit financier des comptes sociaux et consolidés de l’Agence pour l’Aménagement de la Vallée de Bouregreg pour les exercices 2021, 2022 et 2023",AGENCE POUR L'AMENAGEMENT DE LA VALLE DU BOUREGREG,SALE,2022-08-02,11:00,https://www.marchespublics.gov.ma/?page=entreprise.EntrepriseDetailsConsultation&refConsultation=617753&orgAcronyme=g3h&code=&retraits,"Conseil, audit et assistance à maitrise d’ouvrage (à l’exception du domaine des nouvelles technologies)"
1100,AOO,Appel d'offres ouvert,Services,2022-01-17,03/2022/ORH/SPP,"Assistance comptable, financière er fiscale de l’ORMVA du Haouz","Assistance comptable, financière er fiscale de l’ORMVA du Haouz",OFFICE REGIONAL DE MISE EN VALEUR AGRICOLE D'EL HAOUZ,"MARRAKECH, CHICHAOUA, AL HAOUZ, EL KELAA DES SRAGHNA, ESSAOUIRA, REHAMNA, SAFI, YOUSSOUFIA",2022-08-02,11:00,https://www.marchespublics.gov.ma/?page=entreprise.EntrepriseDetailsConsultation&refConsultation=617987&orgAcronyme=q1s&code=&retraits,"Conseil, audit et assistance à maitrise d’ouvrage (à l’exception du domaine des nouvelles technologies)"
1101,AOO,Appel d'offres ouvert,Services,2022-01-17,04/2022/ORH/CSI,"Prestation d’assistance technique en matière d’extension, d’entretien et développement du système d’information de l’ORMVAH","Prestation d’assistance technique en matière d’extension, d’entretien et développement du système d’information de l’ORMVAH",OFFICE REGIONAL DE MISE EN VALEUR AGRICOLE D'EL HAOUZ,"MARRAKECH, CHICHAOUA, AL HAOUZ, EL KELAA DES SRAGHNA, ESSAOUIRA, REHAMNA, SAFI, YOUSSOUFIA",2022-08-02,11:00,https://www.marchespublics.gov.ma/?page=entreprise.EntrepriseDetailsConsultation&refConsultation=617988&orgAcronyme=q1s&code=&retraits,"Conseil, audit et assistance à maitrise d’ouvrage (à l’exception du domaine des nouvelles technologies)"
1102,AOO,Appel d'offres ouvert,Services,2022-01-17,05/2022/ORH/CSI,Maintenance et mise à jour du logiciel intégré SAGE X3 standard édition (version V12) installé au niveau de l’ORMVA du Haouz,Maintenance et mise à jour du logiciel intégré SAGE X3 standard édition (version V12) installé au niveau de l’ORMVA du Haouz,OFFICE REGIONAL DE MISE EN VALEUR AGRICOLE D'EL HAOUZ,"MARRAKECH, CHICHAOUA, AL HAOUZ, EL KELAA DES SRAGHNA, ESSAOUIRA, REHAMNA, SAFI, YOUSSOUFIA",2022-08-02,11:00,https://www.marchespublics.gov.ma/?page=entreprise.EntrepriseDetailsConsultation&refConsultation=617990&orgAcronyme=q1s&code=&retraits,"Conseil, audit et assistance à maitrise d’ouvrage (à l’exception du domaine des nouvelles technologies)"
1103,AOO,Appel d'offres ouvert,Services,2022-01-13,04/A/2022,Assistance technique et le suivi des travaux d'assainissement liquide du centre de BNI FRASSEN -Province de Taza,Assistance technique et le suivi des travaux d'assainissement liquide du centre de BNI FRASSEN -Province de Taza,REGIE AUTONOME DE DISTRIBUTION D'EAU ET D'ELECTRICITE DE TAZA,Province de Taza,2022-08-02,10:30,https://www.marchespublics.gov.ma/?page=entreprise.EntrepriseDetailsConsultation&refConsultation=617434&orgAcronyme=d4q&code=&retraits,"Conseil, audit et assistance à maitrise d’ouvrage (à l’exception du domaine des nouvelles technologies)"
1104,AOO,Appel d'offres ouvert,Services,2022-04-01,1/2022,Mission d’assistance au maître d’ouvrage pour le contrôle et suivi: Travaux d’élargissement et de renforcement de la RR 411 reliant la RR 413 à la Municipalité de Dar Gueddari -Lot unique -Province de Sidi Kacem,Mission d’assistance au maître d’ouvrage pour le contrôle et suivi: Travaux d’élargissement et de renforcement de la RR 411 reliant la RR 413 à la Municipalité de Dar Gueddari -Lot unique -Province de Sidi Kacem,LE DIRECTEUR PROVINCIAL DE L'EQUIPEMENT ET DU TRANSPORT ET DE LA LOGISTIQUE DE SIDI KACEM,SIDI KACEM,2022-08-02,10:00,https://www.marchespublics.gov.ma/?page=entreprise.EntrepriseDetailsConsultation&refConsultation=616712&orgAcronyme=o8p&code=&retraits,"Conseil, audit et assistance à maitrise d’ouvrage (à l’exception du domaine des nouvelles technologies)"
1105,AOO,Appel d'offres ouvert,Services,2022-01-17,04/2022/SOREC,Assistance technique pour la création d’un studio TV pour le compte de la SOREC,Assistance technique pour la création d’un studio TV pour le compte de la SOREC,SOCIETE ROYALE D'ENCOURAGEMENT DU CHEVAL,"TANGER-ASSILAH, MDIQ-FNIDEQ, TETOUAN, FAHS-ANJRA, LARACHE, AL HOCEIMA, CHEFCHAOUEN, OUEZZANE, OUJDA-ANGAD, NADOR, DRIOUCH, JERADA, BERKANE, TAOURIRT, GUERCIF, FIGUIG, FES, MEKNES, EL-HAJEB, IFRANE, MOULAY-YACOUB, SEFROU, BOULEMANE, TAOUNATE, TAZA, RABAT, SALE, SKHIRATE-TEMARA, KENITRA, KHEMISSET, SIDI KACEM, SIDI SLIMANE, BENI MELLAL, AZILAL, FQUIH BEN SALAH, KHENIFRA, KHOURIBGA, CASABLANCA, MOHAMMADIA, EL JADIDA, NOUACEUR, MEDIOUNA, BENSLIMANE, BERRECHID, SETTAT, SIDI BENNOUR, MARRAKECH, CHICHAOUA, AL HAOUZ, EL KELAA DES SRAGHNA, ESSAOUIRA, REHAMNA, SAFI, YOUSSOUFIA, ERRACHIDIA, OUARZAZATE, MIDELT, TINGHIR, ZAGORA, AGADIR IDA OU TANANE, INEZGANE-AIT MELLOUL, CHTOUKA-AIT BAHA, TAROUDANNT, TIZNIT, TATA, GUELMIM, ASSA-ZAG, TAN-TAN, SIDI IFNI, LAAYOUNE, BOUJDOUR, TARFAYA, ES-SEMARA, OUED ED DAHAB, AOUSSERD",2022-08-02,10:00,https://www.marchespublics.gov.ma/?page=entreprise.EntrepriseDetailsConsultation&refConsultation=617830&orgAcronyme=q1s&code=&retraits,"Conseil, audit et assistance à maitrise d’ouvrage (à l’exception du domaine des nouvelles technologies)"
1106,AOO,Appel d'offres ouvert,Services,2022-01-13,01/C/2022,Audit de la qualité de service de la RADEETA,Audit de la qualité de service de la RADEETA,REGIE AUTONOME DE DISTRIBUTION D'EAU ET D'ELECTRICITE DE TAZA,Province de Taza,2022-08-02,09:30,https://www.marchespublics.gov.ma/?page=entreprise.EntrepriseDetailsConsultation&refConsultation=617546&orgAcronyme=d4q&code=&retraits,"Conseil, audit et assistance à maitrise d’ouvrage (à l’exception du domaine des nouvelles technologies)"
1107,AOO,Appel d'offres ouvert,Services,2021-12-24,145/21,EXTERNALISATION DELA COMMERCIALISATION DES,EXTERNALISATION DE RECOUVREMENT SUR LES PRODUITS PARTIELLEMENT VENDUS RELEVANT D’ALOMRANE,RELEVANT D'ALOMRANE CASABLANCA SETTAT (PARIE 2),"MAROC, CASABLANCA",2022-07-02,11:00,https://www.marchespublics.gov.ma/?page=entreprise.EntrepriseDetailsConsultation&refConsultation=615362&orgAcronyme=j8k&code=&retraits,"Conseil, audit et assistance à maitrise d’ouvrage (à l’exception du domaine des nouvelles technologies)"
1108,AOO,Appel d'offres ouvert,Services,2022-12-01,DPARN1/03/2022,"Achèvement de la mission d’assistance technique à la maîtrise d’ouvrage pour le contrôle et suivi des travaux de réalisation de la voie express Tiznit Laayoune, section Tarfaya Oued El Waar du PK 1376+000 au PK 1416+000","Achèvement de la mission d’assistance technique à la maîtrise d’ouvrage pour le contrôle et suivi des travaux de réalisation de la voie express Tiznit Laayoune, section Tarfaya Oued El Waar du PK 1376+000 au PK 1416+000 de la RN1 sur 40 km. Province de Tarfaya.",DIRECTION PROVISOIRE D'AMENAGEMENT DE LA RN1 ENTRE TIZNIT ET DAKHLA,TARFAYA,2022-07-02,11:00,https://www.marchespublics.gov.ma/?page=entreprise.EntrepriseDetailsConsultation&refConsultation=617502&orgAcronyme=o8p&code=&retraits,"Conseil, audit et assistance à maitrise d’ouvrage (à l’exception du domaine des nouvelles technologies)"
1109,AOO,Appel d'offres ouvert,Services,2022-01-13,3/2022/TGR,"la mise en place et l’exécution des prestations de centres d’appel dédiés à la Trésorerie Générale du Royaume, en deux lots séparés :",,,RABAT,2022-07-02,10:00,https://www.marchespublics.gov.ma/?page=entreprise.EntrepriseDetailsConsultation&refConsultation=617548&orgAcronyme=g8e&code=&retraits,"Conseil, audit et assistance à maitrise d’ouvrage (à l’exception du domaine des nouvelles technologies)"
1110,AOO,Appel d'offres ouvert,Services,2022-12-01,01/2022/ANEP,"La réalisation d’un audit comptable et financier de l’Agence Nationale des Equipements Publics au titre des exercices 2021, 2022 et 2023","La réalisation d’un audit comptable et financier de l’Agence Nationale des Equipements Publics au titre des exercices 2021, 2022 et 2023",AGENCE NATIONALE DES EQUIPEMENTS PUBLICS,RABAT,2022-04-02,10:30,https://www.marchespublics.gov.ma/?page=entreprise.EntrepriseDetailsConsultation&refConsultation=617531&orgAcronyme=o8p&code=&retraits,"Conseil, audit et assistance à maitrise d’ouvrage (à l’exception du domaine des nouvelles technologies)"
1111,AOO,Appel d'offres ouvert,Services,2022-01-14,02/2022/SOREC,l’Assistance comptable pour le compte de la SOREC.,l’Assistance comptable pour le compte de la SOREC.,SOCIETE ROYALE D'ENCOURAGEMENT DU CHEVAL,RABAT,2022-04-02,10:00,https://www.marchespublics.gov.ma/?page=entreprise.EntrepriseDetailsConsultation&refConsultation=617741&orgAcronyme=q1s&code=&retraits,"Conseil, audit et assistance à maitrise d’ouvrage (à l’exception du domaine des nouvelles technologies)"
1112,AOO,Appel d'offres ouvert,Services,2022-01-17,01/2022,Assistance technique et suivi de l’état d’avancement des travaux de la rénovation des établissements hôteliers (ETH) dans la ville d’Agadir.,Assistance technique et suivi de l’état d’avancement des travaux de la rénovation des établissements hôteliers (ETH) dans la ville d’Agadir.,Société de Développement Turistique Souss Massa SDR SA,AGADIR IDA OU TANANE,2022-04-02,10:00,https://www.marchespublics.gov.ma/?page=entreprise.EntrepriseDetailsConsultation&refConsultation=617984&orgAcronyme=f9f&code=&retraits,"Conseil, audit et assistance à maitrise d’ouvrage (à l’exception du domaine des nouvelles technologies)"
1113,AOO,Appel d'offres ouvert,Services,2022-10-01,05/2022,Audit technique du contrôle de la qualité d’eau potable,Audit technique du contrôle de la qualité d’eau potable,REGIE AUTONOME MULTI - SERVICES D'AGADIR,Wilaya d'Agadir Ida Outanane,2022-02-02,11:00,https://www.marchespublics.gov.ma/?page=entreprise.EntrepriseDetailsConsultation&refConsultation=617108&orgAcronyme=g3h&code=&retraits,"Conseil, audit et assistance à maitrise d’ouvrage (à l’exception du domaine des nouvelles technologies)"
1114,AOO,Appel d'offres ouvert,Services,2022-07-01,02/2022/RRA,"Etudes techniques, contrôle général et suivi technique des travaux de construction du centre d’archivage et de logistique du conseil Supérieur du pouvoir judiciaire a Hay Riad Rabat","Etudes techniques, contrôle général et suivi technique des travaux de construction du centre d’archivage et de logistique du conseil Supérieur du pouvoir judiciaire a Hay Riad Rabat",RABAT REGION AMENAGEMENT,RABAT,2022-01-02,11:00,https://www.marchespublics.gov.ma/?page=entreprise.EntrepriseDetailsConsultation&refConsultation=617211&orgAcronyme=g8e&code=&retraits,"Conseil, audit et assistance à maitrise d’ouvrage (à l’exception du domaine des nouvelles technologies)"
1115,AOO,Appel d'offres ouvert,Services,2021-12-31,32/21,"la conception   l’étude et  la mise en place de la cartographie des risques à l’Institut Pasteur du Maroc (Sites : Casa, Tit Mellil & Tanger","la conception   l’étude et  la mise en place de la cartographie des risques à l’Institut Pasteur du Maroc (Sites : Casa, Tit Mellil & Tanger",INSTITUT PASTEUR DU MAROC,Wialaya de Casablanca Anfa,2022-01-02,10:30,https://www.marchespublics.gov.ma/?page=entreprise.EntrepriseDetailsConsultation&refConsultation=616432&orgAcronyme=q9t&code=&retraits,"Conseil, audit et assistance à maitrise d’ouvrage (à l’exception du domaine des nouvelles technologies)"
1116,AOO,Appel d'offres ouvert,Services,2021-12-20,35/2021,Assistance technique pour l’évaluation du dispositif de la formation en milieu de travail « apprentissage et alternée » « Lot unique »,Assistance technique pour l’évaluation du dispositif de la formation en milieu de travail « apprentissage et alternée » « Lot unique »,DOMAINE DE LA FORMATION PROFESSIONNELLE,"TANGER-ASSILAH, MDIQ-FNIDEQ, TETOUAN, FAHS-ANJRA, LARACHE, AL HOCEIMA, CHEFCHAOUEN, OUEZZANE, OUJDA-ANGAD, NADOR, DRIOUCH, JERADA, BERKANE, TAOURIRT, GUERCIF, FIGUIG, FES, MEKNES, EL-HAJEB, IFRANE, MOULAY-YACOUB, SEFROU, BOULEMANE, TAOUNATE, TAZA, RABAT, SALE, SKHIRATE-TEMARA, KENITRA, KHEMISSET, SIDI KACEM, SIDI SLIMANE, BENI MELLAL, AZILAL, FQUIH BEN SALAH, KHENIFRA, KHOURIBGA, CASABLANCA, MOHAMMADIA, EL JADIDA, NOUACEUR, MEDIOUNA, BENSLIMANE, BERRECHID, SETTAT, SIDI BENNOUR, MARRAKECH, CHICHAOUA, AL HAOUZ, EL KELAA DES SRAGHNA, ESSAOUIRA, REHAMNA, SAFI, YOUSSOUFIA, ERRACHIDIA, OUARZAZATE, MIDELT, TINGHIR, ZAGORA, AGADIR IDA OU TANANE, INEZGANE-AIT MELLOUL, CHTOUKA-AIT BAHA, TAROUDANNT, TIZNIT, TATA, GUELMIM, ASSA-ZAG, TAN-TAN, SIDI IFNI, LAAYOUNE, BOUJDOUR, TARFAYA, ES-SEMARA, OUED ED DAHAB, AOUSSERD",2022-01-02,10:00,https://www.marchespublics.gov.ma/?page=entreprise.EntrepriseDetailsConsultation&refConsultation=614621&orgAcronyme=z7r&code=&retraits,"Conseil, audit et assistance à maitrise d’ouvrage (à l’exception du domaine des nouvelles technologies)"
1117,AOO,Appel d'offres ouvert,Services,2022-07-01,57/DAM/S/2021,ASSISTANCE TECHNIQUE POUR LE PROJET DE L'INVENTAIRE RAPPROCHE DU PATRIMOINE DE L’ONEE-BRANCHE EAU,ASSISTANCE TECHNIQUE POUR LE PROJET DE L'INVENTAIRE RAPPROCHE DU PATRIMOINE DE L’ONEE-BRANCHE EAU,OFFICE NATIONAL DE L'ELECTRICITE ET DE L'EAU POTABLE - BRANCHE EAU,"TANGER-ASSILAH, MDIQ-FNIDEQ, TETOUAN, FAHS-ANJRA, LARACHE, AL HOCEIMA, CHEFCHAOUEN, OUEZZANE, OUJDA-ANGAD, NADOR, DRIOUCH, JERADA, BERKANE, TAOURIRT, GUERCIF, FIGUIG, FES, MEKNES, EL-HAJEB, IFRANE, MOULAY-YACOUB, SEFROU, BOULEMANE, TAOUNATE, TAZA, RABAT, SALE, SKHIRATE-TEMARA, KENITRA, KHEMISSET, SIDI KACEM, SIDI SLIMANE, BENI MELLAL, AZILAL, FQUIH BEN SALAH, KHENIFRA, KHOURIBGA, CASABLANCA, MOHAMMADIA, EL JADIDA, NOUACEUR, MEDIOUNA, BENSLIMANE, BERRECHID, SETTAT, SIDI BENNOUR, MARRAKECH, CHICHAOUA, AL HAOUZ, EL KELAA DES SRAGHNA, ESSAOUIRA, REHAMNA, SAFI, YOUSSOUFIA, ERRACHIDIA, OUARZAZATE, MIDELT, TINGHIR, ZAGORA, AGADIR IDA OU TANANE, INEZGANE-AIT MELLOUL, CHTOUKA-AIT BAHA, TAROUDANNT, TIZNIT, TATA, GUELMIM, ASSA-ZAG, TAN-TAN, SIDI IFNI, LAAYOUNE, BOUJDOUR, TARFAYA, ES-SEMARA, OUED ED DAHAB, AOUSSERD",2022-01-02,10:00,https://www.marchespublics.gov.ma/?page=entreprise.EntrepriseDetailsConsultation&refConsultation=616858&orgAcronyme=d4q&code=&retraits,"Conseil, audit et assistance à maitrise d’ouvrage (à l’exception du domaine des nouvelles technologies)"
1118,AOO,Appel d'offres ouvert,Services,2022-07-01,01/AO/B_CULTURES/2022,la réalisation de la mission d’audit des marchés dont le montant est supérieur à 5 Millions de dirhams et les marchés négociés dont le montant supérieur à 1 Million de dirhams et un échantillon des bons de commande de,la réalisation de la mission d’audit des marchés dont le montant est supérieur à 5 Millions de dirhams et les marchés négociés dont le montant supérieur à 1 Million de dirhams et un échantillon des bons de commande de la société Bouregreg Cultures,LA SOCIETE BOUREGREG CULTURES,"RABAT, SALE",2022-01-31,10:00,https://www.marchespublics.gov.ma/?page=entreprise.EntrepriseDetailsConsultation&refConsultation=617180&orgAcronyme=g3h&code=&retraits,"Conseil, audit et assistance à maitrise d’ouvrage (à l’exception du domaine des nouvelles technologies)"
1119,AMI,Appel à manifestation d'intérêt,Services,2022-10-01,01/BM/2022,RECRUTEMENT D'UN CONSULTANT POUR L'AUDIT DES FINANCEMENTS ACCORDES AU PROJET PAR LA BANQUE MONDIALE SOUS FORME DE DON A L'ANAPEC (EXERCICES 2019-2020 ET 2021).,RECRUTEMENT D'UN CONSULTANT POUR L'AUDIT DES FINANCEMENTS ACCORDES AU PROJET PAR LA BANQUE MONDIALE SOUS FORME DE DON A L'ANAPEC (EXERCICES 2019-2020 ET 2021).,AGENCE NATIONALE POUR LA PROMOTION DE L'EMPLOI ET DES COMPETENCES,CASABLANCA,2022-01-28,16:00,https://www.marchespublics.gov.ma/?page=entreprise.EntrepriseDetailsConsultation&refConsultation=617284&orgAcronyme=o4d&code=&retraits,"Conseil, audit et assistance à maitrise d’ouvrage (à l’exception du domaine des nouvelles technologies)"
1120,AOO,Appel d'offres ouvert,Services,2022-05-01,2787/2022/radees,Audit du rendement du réseau d’eau potable,Audit du rendement du réseau d’eau potable,REGIE AUTONOME DE DISTRIBUTION D'EAU ET D'ELECTRICITE DE SAFI,SAFI,2022-01-27,11:00,https://www.marchespublics.gov.ma/?page=entreprise.EntrepriseDetailsConsultation&refConsultation=616671&orgAcronyme=g3h&code=&retraits,"Conseil, audit et assistance à maitrise d’ouvrage (à l’exception du domaine des nouvelles technologies)"
1121,AOO,Appel d'offres ouvert,Services,2022-03-01,18/2021/ONICL/DRHAA/SAMG,"Réalisation de l’Audit Annuel Financier et Comptable de l'Office National Interprofessionnel des Céréales et des Légumineuses et de ses Silos à Céréales des Ports de Casablanca, Safi, Agadir et Nador en Lot Unique.","Réalisation de l’Audit Annuel Financier et Comptable de l'Office National Interprofessionnel des Céréales et des Légumineuses et de ses Silos à Céréales des Ports de Casablanca, Safi, Agadir et Nador en Lot Unique.",OFFICE NATIONAL INTERPROFESSIONNEL DES CEREALES ET LEGUMINEUSES,"RABAT, CASABLANCA",2022-01-27,10:30,https://www.marchespublics.gov.ma/?page=entreprise.EntrepriseDetailsConsultation&refConsultation=616593&orgAcronyme=q1s&code=&retraits,"Conseil, audit et assistance à maitrise d’ouvrage (à l’exception du domaine des nouvelles technologies)"
1122,AOO,Appel d'offres ouvert,Services,2022-06-01,AO.01/BCM/2022,Assistance pour la passation du contrat d’exploitation du service public du transport collectif par Bus sur le territoire du Grand Marrakech,Assistance pour la passation du contrat d’exploitation du service public du transport collectif par Bus sur le territoire du Grand Marrakech,BUS CITY MOTAJADIDA société de développement local,"MARRAKECH, CHICHAOUA, AL HAOUZ, EL KELAA DES SRAGHNA, ESSAOUIRA, REHAMNA, SAFI, YOUSSOUFIA",2022-01-27,10:00,https://www.marchespublics.gov.ma/?page=entreprise.EntrepriseDetailsConsultation&refConsultation=617062&orgAcronyme=j0w&code=&retraits,"Conseil, audit et assistance à maitrise d’ouvrage (à l’exception du domaine des nouvelles technologies)"
1123,AOO,Appel d'offres ouvert,Services,2022-05-01,2785/2022/radees,Assistance technique pour la réalisation du système de prétraitement et de transfert des eaux usées vers la STEP de la ville de Safi,Assistance technique pour la réalisation du système de prétraitement et de transfert des eaux usées vers la STEP de la ville de Safi,REGIE AUTONOME DE DISTRIBUTION D'EAU ET D'ELECTRICITE DE SAFI,SAFI,2022-01-27,09:30,https://www.marchespublics.gov.ma/?page=entreprise.EntrepriseDetailsConsultation&refConsultation=616666&orgAcronyme=g3h&code=&retraits,"Conseil, audit et assistance à maitrise d’ouvrage (à l’exception du domaine des nouvelles technologies)"
1124,AOO,Appel d'offres ouvert,Services,2021-12-29,49/2021/TZ,Mission d’assistance au Maitre d’ouvrage  pour le contrôle et suivi des Travaux d’élargissement et de renforcement de la RP5413 du PK16+000 AU PK 31+845. Province de Taza.,Mission d’assistance au Maitre d’ouvrage  pour le contrôle et suivi des Travaux d’élargissement et de renforcement de la RP5413 du PK16+000 AU PK 31+845. Province de Taza.,LE DIRECTEUR PROVINCIAL DE L'EQUIPEMENT ET DU TRANSPORT ET DE LA LOGISTIQUE DE TAZA,TAZA,2022-01-26,10:30,https://www.marchespublics.gov.ma/?page=entreprise.EntrepriseDetailsConsultation&refConsultation=616037&orgAcronyme=o8p&code=&retraits,"Conseil, audit et assistance à maitrise d’ouvrage (à l’exception du domaine des nouvelles technologies)"
