,procedure,categorie,type_of_work,posting_time,reference,programmme,objet,acheteur_public,lieu_d_execution,date_close,time_close,action,industry
0,AOO,Appel d'offres ouvert,Travaux,2021-03-26,18/2021/DPEFLCD/AZ,Travaux de Reboisement sur une superficie totale de 55 Ha répartie en Deux (02) lots,Travaux de Reboisement sur une superficie totale de 55 Ha répartie en Deux (02) lots,DIRECTEUR PROVINCIAL DES EAUX ET FORETS A AZILAL,AZILAL,2022-06-30,10:00,https://www.marchespublics.gov.ma/?page=entreprise.EntrepriseDetailsConsultation&refConsultation=563151&orgAcronyme=w7t&code=&retraits,Travaux Forestiers
1,AOO,Appel d'offres ouvert,Travaux,2022-04-01,04/2022/DREFLCD/HA,"Fourniture  de plants forestiers individualisés normalisés en substrat et conteneur exigés (au minimum710.850 plants, au maximum 1 421.700 plants), à livrer au niveau des pépinières forestières de la Palmeraie et de","Fourniture  de plants forestiers individualisés normalisés en substrat et conteneur exigés (au minimum710.850 plants, au maximum 1 421.700 plants), à livrer au niveau des pépinières forestières de la Palmeraie et de l’Ounasda relevant de la DREFLCD du Haut Atlas  à Marrakech.",DIRECTEUR REGIONAL DES EAUX ET FORETS HAUT ATLAS MARRAKECH,MARRAKECH,2022-02-14,11:00,https://www.marchespublics.gov.ma/?page=entreprise.EntrepriseDetailsConsultation&refConsultation=616768&orgAcronyme=w7t&code=&retraits,Travaux Forestiers
2,AOO,Appel d'offres ouvert,Fournitures,2022-04-01,03/2022/DREFLCD/HA,la fourniture  de plants forestiers répartis en deux lots,la fourniture  de plants forestiers répartis en deux lots,DIRECTEUR REGIONAL DES EAUX ET FORETS HAUT ATLAS MARRAKECH,"AL HAOUZ, ESSAOUIRA",2022-02-14,10:00,https://www.marchespublics.gov.ma/?page=entreprise.EntrepriseDetailsConsultation&refConsultation=616759&orgAcronyme=w7t&code=&retraits,Travaux Forestiers
3,AOO,Appel d'offres ouvert,Travaux,2021-12-28,02/2021,la fourniture de plants forestiers individualisés normalisés en substrat et conteneur exigés au profit de la DREFLCD du Centre à Casablanca (lot unique).,la fourniture de plants forestiers individualisés normalisés en substrat et conteneur exigés au profit de la DREFLCD du Centre à Casablanca (lot unique).,DIRECTEUR REGIONAL EAUX ET FORETS DE LA REGION DU CENTRE A CASA,"CASABLANCA, MOHAMMADIA, EL JADIDA, NOUACEUR, MEDIOUNA, BENSLIMANE, BERRECHID, SETTAT, SIDI BENNOUR",2022-08-02,10:00,https://www.marchespublics.gov.ma/?page=entreprise.EntrepriseDetailsConsultation&refConsultation=615608&orgAcronyme=w7t&code=&retraits,Travaux Forestiers
4,AOO,Appel d'offres ouvert,Fournitures,2022-07-01,01/2022/DREFLCDRSZZ,"fourniture de  plants forestiers (Plants issus de semis et plants haute tiges) individualisés normalisés en substrat et conteneur exigés, à livrer au niveau de la pépinière forestière de Sidi Amira, relevant de la DPEFLCD","fourniture de  plants forestiers (Plants issus de semis et plants haute tiges) individualisés normalisés en substrat et conteneur exigés, à livrer au niveau de la pépinière forestière de Sidi Amira, relevant de la DPEFLCD de Rabat (lot unique).",Direction Regionale des Eaux et Forets et de la Lutte Contre la Desertification de Rabat Sale Zemmour Zaer a Khemisset,SALE,2022-01-31,10:00,https://www.marchespublics.gov.ma/?page=entreprise.EntrepriseDetailsConsultation&refConsultation=617137&orgAcronyme=w7t&code=&retraits,Travaux Forestiers
5,AOO,Appel d'offres ouvert,Travaux,2021-12-28,25/2021/DPA/IF,"Travaux de plantation des plantules de cactus à la C.T de Sbouya, Cercle d’Ifni, Province de Sidi Ifni dans le cadre de l’Agriculture solidaire de la Génération Green.","Travaux de plantation des plantules de cactus à la C.T de Sbouya, Cercle d’Ifni, Province de Sidi Ifni dans le cadre de l’Agriculture solidaire de la Génération Green.",Direction Pronvinciale de l'Agriculture de Sidi Ifni,SIDI IFNI,2022-01-20,10:00,https://www.marchespublics.gov.ma/?page=entreprise.EntrepriseDetailsConsultation&refConsultation=615782&orgAcronyme=q1s&code=&retraits,Travaux Forestiers
6,AOO,Appel d'offres ouvert,Travaux,2021-12-30,02/2021,Programme prévisionnel 2021,Programme prévisionnel 2021,Collectivité territoriale de SIDI TAIBI,KENITRA,2022-03-30,10:00,https://www.marchespublics.gov.ma/?page=entreprise.EntrepriseDetailsConsultation&refConsultation=616276&orgAcronyme=i1t&code=&retraits,Travaux de construction et d’aménagement
7,AOO,Appel d'offres ouvert,Travaux,2021-12-31,147/2021/DAH,Achèvement des travaux de construction du barrage M’dez dans la province de Sefrou,Achèvement des travaux de construction du barrage M’dez dans la province de Sefrou,DIRECTEUR DES AMENAGEMENTS HYDRAULIQUES,SEFROU,2022-02-25,10:00,https://www.marchespublics.gov.ma/?page=entreprise.EntrepriseDetailsConsultation&refConsultation=616371&orgAcronyme=k2q&code=&retraits,Travaux de construction et d’aménagement
8,AOO,Appel d'offres ouvert,Travaux,2022-12-01,01/2022,TRAVAUX D’AMENAGEMENT DE LA SALLE DE SPECTACLE ABDESSAMAD EL KANFAOUI RELEVANT DE LA DIRECTION REGIONALE CASABLANCA-SETTAT.,TRAVAUX D’AMENAGEMENT DE LA SALLE DE SPECTACLE ABDESSAMAD EL KANFAOUI RELEVANT DE LA DIRECTION REGIONALE CASABLANCA-SETTAT.,DELEGUE PREFECTORAL DE LA JEUNESSE ET DES SPORTS - PREFECTURE D'ARRONDISSEMENT CASA ANFA,CASABLANCA,2022-02-25,10:00,https://www.marchespublics.gov.ma/?page=entreprise.EntrepriseDetailsConsultation&refConsultation=617463&orgAcronyme=s3d&code=&retraits,Travaux de construction et d’aménagement
9,AOO,Appel d'offres ouvert,Travaux,2021-12-29,104DR3/21,AEP par branchement individuels des douars relevant de la commune laqraqra (1ère tranche) Lot : Génie civil et  Equipement-,AEP par branchement individuels des douars relevant de la commune laqraqra (1ère tranche) Lot : Génie civil et  Equipement-,OFFICE NATIONAL DE L'ELECTRICITE ET DE L'EAU POTABLE - BRANCHE EAU,SETTAT,2022-02-22,10:00,https://www.marchespublics.gov.ma/?page=entreprise.EntrepriseDetailsConsultation&refConsultation=615733&orgAcronyme=d4q&code=&retraits,Travaux de construction et d’aménagement
10,AOO,Appel d'offres ouvert,Travaux,2022-01-17,02/2022,TRAVAUX DE REHABILITATION ET D’AMENAGEMENT DU PARC COMMUNAL A LA COMMUNE LOULAD - PROVINCE DE SETTAT.,TRAVAUX DE REHABILITATION ET D’AMENAGEMENT DU PARC COMMUNAL A LA COMMUNE LOULAD - PROVINCE DE SETTAT.,Commune urbaine de LOULAD,"MAROC, SETTAT",2022-02-17,11:00,https://www.marchespublics.gov.ma/?page=entreprise.EntrepriseDetailsConsultation&refConsultation=617897&orgAcronyme=h5r&code=&retraits,Travaux de construction et d’aménagement
11,AOO,Appel d'offres ouvert,Travaux,2021-12-28,TN4114949/2021/ONEEBELEC,Renforcement de la sécurité des postes relevant de la DTN/XT,Renforcement de la sécurité des postes relevant de la DTN/XT,OFFICE NATIONALE DE L'ELECTRICITE ET DE L'EAU POTABLE - BRANCHE ELECTRICITE,"Wilaya de Tetouan, Wilaya de Tanger Assilah",2022-02-17,09:00,https://www.marchespublics.gov.ma/?page=entreprise.EntrepriseDetailsConsultation&refConsultation=615859&orgAcronyme=d4q&code=&retraits,Travaux de construction et d’aménagement
12,AOO,Appel d'offres ouvert,Travaux,2022-01-14,38/2021/BP,TRAVAUX D’ACHEVEMENT D'UN ESPACE POUR LA PRODUCTION ET LA COMMERCIALISATION DES PRODUITS DE L'ARTISAN A LA COMMUNE TERRITORIALE DE TAMELLALET A LA PROVINCE D'EL KELAA DE SRAGHNA,TRAVAUX D’ACHEVEMENT D'UN ESPACE POUR LA PRODUCTION ET LA COMMERCIALISATION DES PRODUITS DE L'ARTISAN A LA COMMUNE TERRITORIALE DE TAMELLALET A LA PROVINCE D'EL KELAA DE SRAGHNA,PROVINCE D'EL KELAA DES SRAGHNA,Province de Kelaa des Sraghnas,2022-02-16,11:00,https://www.marchespublics.gov.ma/?page=entreprise.EntrepriseDetailsConsultation&refConsultation=617761&orgAcronyme=j0w&code=&retraits,Travaux de construction et d’aménagement
13,AOO,Appel d'offres ouvert,Travaux,2021-12-27,02/2021/ISMAC,"la réalisation des travaux d’aménagement et traitement acoustique à l’Institut Supérieur des Métiers de l’Audiovisuel et du Cinéma à Rabat, en lot unique","la réalisation des travaux d’aménagement et traitement acoustique à l’Institut Supérieur des Métiers de l’Audiovisuel et du Cinéma à Rabat, en lot unique",INSTITUT SUPERIEUR DES METIERS DE L'AUDIO-VISUEL ET DU CINEMA,RABAT,2022-02-15,11:00,https://www.marchespublics.gov.ma/?page=entreprise.EntrepriseDetailsConsultation&refConsultation=615565&orgAcronyme=x6c&code=&retraits,Travaux de construction et d’aménagement
14,AOO,Appel d'offres ouvert,Travaux,2021-12-27,29/2021,travaux de construction de la division de famille de sale,travaux de construction de la division de famille de sale,SOUS DIRECTEUR REGIONAL AUPRES DE LA COUR D'APPEL DE RABAT,"Préfecture de Skhirate Temara, Préfecture de Salé Al Jadida, Préfecture de Salé Medina, Province de Khemissat, Wilaya de Rabat",2022-11-02,10:00,https://www.marchespublics.gov.ma/?page=entreprise.EntrepriseDetailsConsultation&refConsultation=614380&orgAcronyme=t5y&code=&retraits,Travaux de construction et d’aménagement
15,AOO,Appel d'offres ouvert,Travaux,2022-01-17,07/FDR/2021,TRAVAUX D’EXTENSION DU LYCEE COLLEGIALE EL MOKHTAR ESSOUSSI : CONSTRUCTION DE QUATRE SALLES DE CLASSE DE L'ENSEIGNEMENT GENERAL ET UN BLOC SANITAIRE A LA COMMUNE TIDILI - PROVINCE D’OUARZAZATE-,TRAVAUX D’EXTENSION DU LYCEE COLLEGIALE EL MOKHTAR ESSOUSSI : CONSTRUCTION DE QUATRE SALLES DE CLASSE DE L'ENSEIGNEMENT GENERAL ET UN BLOC SANITAIRE A LA COMMUNE TIDILI - PROVINCE D’OUARZAZATE-,GOUVERNEUR DE OUARZAZATE,OUARZAZATE,2022-10-02,11:00,https://www.marchespublics.gov.ma/?page=entreprise.EntrepriseDetailsConsultation&refConsultation=617883&orgAcronyme=g3h&code=&retraits,Travaux de construction et d’aménagement
16,AOO,Appel d'offres ouvert,Travaux,2021-12-30,309/2021/OFPPT,Travaux de Construction de la Cité des Métiers et des Compétences de la région DAKHLA OUED ED DAHAB A DAKHLA,Travaux de Construction de la Cité des Métiers et des Compétences de la région DAKHLA OUED ED DAHAB A DAKHLA,OFFICE DE LA FORMATION PROFESSIONNELLE ET DE LA PROMOTION DU TRAVAIL,OUED ED DAHAB,2022-10-02,10:00,https://www.marchespublics.gov.ma/?page=entreprise.EntrepriseDetailsConsultation&refConsultation=616155&orgAcronyme=o4d&code=&retraits,Travaux de construction et d’aménagement
17,AOO,Appel d'offres ouvert,Travaux,2022-10-01,18/2022/apdn,"Travaux de remplacement en dur d’un logement de fonction et aménagement des logements de fonction du centre de santé de Sidi El Yamani, préfecture de Tanger - Assilah","Travaux de remplacement en dur d’un logement de fonction et aménagement des logements de fonction du centre de santé de Sidi El Yamani, préfecture de Tanger - Assilah",AGENCE POUR LA PROMOTION ET LE DEVELOPPEMENT ECONOMIQUE ET SOCIAL DES PREFECTURES ET PROVINCES DU NORD DU ROYAUME,TANGER-ASSILAH,2022-10-02,10:00,https://www.marchespublics.gov.ma/?page=entreprise.EntrepriseDetailsConsultation&refConsultation=617340&orgAcronyme=a1t&code=&retraits,Travaux de construction et d’aménagement
18,AOO,Appel d'offres ouvert,Travaux,2022-01-14,21/2021/SAT,Réaménagement du siège de la  2ème Annexe Administrative - commune de Taza -  Province de Taza. Tranche I,Réaménagement du siège de la  2ème Annexe Administrative - commune de Taza -  Province de Taza. Tranche I,Commune urbaine de TAZA,Province de Taza,2022-10-02,10:00,https://www.marchespublics.gov.ma/?page=entreprise.EntrepriseDetailsConsultation&refConsultation=617785&orgAcronyme=d0q&code=&retraits,Travaux de construction et d’aménagement
19,AOO,Appel d'offres ouvert,Travaux,2022-01-17,05/FDR/2021,TRAVAUX DE CONSTRUCTION DES MURS DE CLOTURE DES ETABLISSEMENTS SCOLAIRES AU NIVEAU DES COMMUNES IMINOULAOUENE ET TOUNDOUTE A LA PROVINCE D’OUARZAZATE.,TRAVAUX DE CONSTRUCTION DES MURS DE CLOTURE DES ETABLISSEMENTS SCOLAIRES AU NIVEAU DES COMMUNES IMINOULAOUENE ET TOUNDOUTE A LA PROVINCE D’OUARZAZATE.,GOUVERNEUR DE OUARZAZATE,OUARZAZATE,2022-10-02,10:00,https://www.marchespublics.gov.ma/?page=entreprise.EntrepriseDetailsConsultation&refConsultation=617873&orgAcronyme=g3h&code=&retraits,Travaux de construction et d’aménagement
20,AOO,Appel d'offres ouvert,Travaux,2022-01-17,02/2022/INDH,"Travaux de Construction d’une Maison pour les Personnes Agées à la ville d’Assa, Province d’Assa-Zag.","Travaux de Construction d’une Maison pour les Personnes Agées à la ville d’Assa, Province d’Assa-Zag.",GOUVERNEUR DE LA PROVINCE D'ASSA-ZAG,Province d'Assa Zag,2022-09-02,13:30,https://www.marchespublics.gov.ma/?page=entreprise.EntrepriseDetailsConsultation&refConsultation=617934&orgAcronyme=g3h&code=&retraits,Travaux de construction et d’aménagement
21,AOO,Appel d'offres ouvert,Travaux,2022-01-17,1/2022/INDH,"Travaux de Construction d’un Centre d’animation, d’épanouissement sociale et d’éducation y compris 2 terrains de sport à la ville d’Assa, Province d’Assa-Zag.","Travaux de Construction d’un Centre d’animation, d’épanouissement sociale et d’éducation y compris 2 terrains de sport à la ville d’Assa, Province d’Assa-Zag.",GOUVERNEUR DE LA PROVINCE D'ASSA-ZAG,Province d'Assa Zag,2022-09-02,12:30,https://www.marchespublics.gov.ma/?page=entreprise.EntrepriseDetailsConsultation&refConsultation=617911&orgAcronyme=g3h&code=&retraits,Travaux de construction et d’aménagement
22,AOO,Appel d'offres ouvert,Travaux,2022-01-14,02/oz/2022,Travaux de construction de deux bornes fontaines aux douars( mohamed ben bouchaib chlouh - fatihi oulad ben omar) relevant de la commun,Travaux de construction de deux bornes fontaines aux douars( mohamed ben bouchaib chlouh - fatihi oulad ben omar) relevant de la commun,Commune Rurale de OULAD ZIANE,BERRECHID,2022-09-02,12:00,https://www.marchespublics.gov.ma/?page=entreprise.EntrepriseDetailsConsultation&refConsultation=617758&orgAcronyme=h5r&code=&retraits,Travaux de construction et d’aménagement
23,AOO,Appel d'offres ouvert,Travaux,2022-03-01,37/2021/BP,"TRAVAUX DE RECONSTRUCTION DU CENTRE COMMERCIAL A L’AVENUE MOULAY ISMAIL ALA VILLE D’EL KELAA DES SRAGHNA, PROVINCE D’EL KELAA DES SRAGHNA.","TRAVAUX DE RECONSTRUCTION DU CENTRE COMMERCIAL A L’AVENUE MOULAY ISMAIL ALA VILLE D’EL KELAA DES SRAGHNA, PROVINCE D’EL KELAA DES SRAGHNA.",PROVINCE D'EL KELAA DES SRAGHNA,Province de Kelaa des Sraghnas,2022-09-02,11:00,https://www.marchespublics.gov.ma/?page=entreprise.EntrepriseDetailsConsultation&refConsultation=616612&orgAcronyme=j0w&code=&retraits,Travaux de construction et d’aménagement
24,AOO,Appel d'offres ouvert,Travaux,2022-10-01,31/2022/apdn,Travaux d’aménagement extérieur de la salle couverte omnisport ARENA à la cité sportive de Tanger,Travaux d’aménagement extérieur de la salle couverte omnisport ARENA à la cité sportive de Tanger,AGENCE POUR LA PROMOTION ET LE DEVELOPPEMENT ECONOMIQUE ET SOCIAL DES PREFECTURES ET PROVINCES DU NORD DU ROYAUME,TANGER-ASSILAH,2022-09-02,10:00,https://www.marchespublics.gov.ma/?page=entreprise.EntrepriseDetailsConsultation&refConsultation=617347&orgAcronyme=a1t&code=&retraits,Travaux de construction et d’aménagement
25,AOO,Appel d'offres ouvert,Travaux,2022-01-14,01/2022,Travaux de construction de dix châteaux d’eau aux douars ( zlayghate (jadi)-nzala(oulad el  harrati) -dispensaire ouled ben amro - el kaid ouled abbasse –kttaba jawadi  -hadrate- abdlafdil  rhahwa-chorfa(wahab)- lahwarta,Travaux de construction de dix châteaux d’eau aux douars ( zlayghate (jadi)-nzala(oulad el  harrati) -dispensaire ouled ben amro - el kaid ouled abbasse –kttaba jawadi  -hadrate- abdlafdil  rhahwa-chorfa(wahab)- lahwarta jowak- hossniatt chlouh) relevant de la commune oulad ziane.,Commune Rurale de OULAD ZIANE,BERRECHID,2022-09-02,10:00,https://www.marchespublics.gov.ma/?page=entreprise.EntrepriseDetailsConsultation&refConsultation=617789&orgAcronyme=h5r&code=&retraits,Travaux de construction et d’aménagement
26,AOO,Appel d'offres ouvert,Travaux,2022-01-13,SAPSB/01/2022,Travaux d'entretien et d'aménagement des écoles traditionnelles de Sidi Bennour.,,,SIDI BENNOUR,2022-08-02,11:00,https://www.marchespublics.gov.ma/?page=entreprise.EntrepriseDetailsConsultation&refConsultation=617600&orgAcronyme=g3h&code=&retraits,Travaux de construction et d’aménagement
27,AOO,Appel d'offres ouvert,Travaux,2022-10-01,26/2022/apdn,Travaux de construction de l’internat au collège Sahel Chamali dans la commune de Sahel Chamali/Mejlaw - préfecture de Tanger - Assilah,Travaux de construction de l’internat au collège Sahel Chamali dans la commune de Sahel Chamali/Mejlaw - préfecture de Tanger - Assilah,AGENCE POUR LA PROMOTION ET LE DEVELOPPEMENT ECONOMIQUE ET SOCIAL DES PREFECTURES ET PROVINCES DU NORD DU ROYAUME,TANGER-ASSILAH,2022-08-02,10:00,https://www.marchespublics.gov.ma/?page=entreprise.EntrepriseDetailsConsultation&refConsultation=617342&orgAcronyme=a1t&code=&retraits,Travaux de construction et d’aménagement
28,AOO,Appel d'offres ouvert,Travaux,2022-12-01,01/2022/FDR,Travaux  de réhabilitation et  d’aménagement d’un  terrain de sport à l’école Ouarkou centre à  la préfecture de Mohammedia,Travaux  de réhabilitation et  d’aménagement d’un  terrain de sport à l’école Ouarkou centre à  la préfecture de Mohammedia,GOUVERNEUR DE LA PREFECTURE DE MOHAMMADIA,MOHAMMADIA,2022-08-02,10:00,https://www.marchespublics.gov.ma/?page=entreprise.EntrepriseDetailsConsultation&refConsultation=617422&orgAcronyme=g3h&code=&retraits,Travaux de construction et d’aménagement
29,AOO,Appel d'offres ouvert,Travaux,2022-01-14,08/FDR/2021,TRAVAUX DE CONSTRUCTION D’UN DISPENSAIRE RURAL ET D’UN LOGEMENT D’INFERMIER A AGUERD A LA COMMUNE TERRITORIALE IMINOULAOUEN PROVINCE D’OUARZAZATE.,TRAVAUX DE CONSTRUCTION D’UN DISPENSAIRE RURAL ET D’UN LOGEMENT D’INFERMIER A AGUERD A LA COMMUNE TERRITORIALE IMINOULAOUEN PROVINCE D’OUARZAZATE.,GOUVERNEUR DE OUARZAZATE,OUARZAZATE,2022-08-02,10:00,https://www.marchespublics.gov.ma/?page=entreprise.EntrepriseDetailsConsultation&refConsultation=617703&orgAcronyme=g3h&code=&retraits,Travaux de construction et d’aménagement
30,AOO,Appel d'offres ouvert,Travaux,2022-01-17,05/2022/SAO,TRAVAUX DE MISE A NIVEAU DU CENTRE DE MELG AL OUIDANE AMENAGEMENT DE LA VOIRIE DU QUARTIER OULED ALI ET LA VOIE D’ACCES - PROVINCE DE TAOURIRT -,TRAVAUX DE MISE A NIVEAU DU CENTRE DE MELG AL OUIDANE AMENAGEMENT DE LA VOIRIE DU QUARTIER OULED ALI ET LA VOIE D’ACCES - PROVINCE DE TAOURIRT -,SOCIETE ALOMRANE REGION DE L’ORIENTAL,TAOURIRT,2022-08-02,10:00,https://www.marchespublics.gov.ma/?page=entreprise.EntrepriseDetailsConsultation&refConsultation=617908&orgAcronyme=j8k&code=&retraits,Travaux de construction et d’aménagement
31,AOO,Appel d'offres ouvert,Travaux,2022-01-17,06/2022/SAO,TRAVAUX DE CONSTRUCTION DES BLOCS SANITAIRE A BERKANE- PROVINCE DE BERKANE -,TRAVAUX DE CONSTRUCTION DES BLOCS SANITAIRE A BERKANE- PROVINCE DE BERKANE -,SOCIETE ALOMRANE REGION DE L’ORIENTAL,BERKANE,2022-08-02,10:00,https://www.marchespublics.gov.ma/?page=entreprise.EntrepriseDetailsConsultation&refConsultation=617910&orgAcronyme=j8k&code=&retraits,Travaux de construction et d’aménagement
32,AOO,Appel d'offres ouvert,Travaux,2022-01-17,07/2022/SAO,MISE A NIVEAU DE LA VILLE DE BERKANE TRAVAUX D’AMENAGEMENT PAYSAGER D’UNE PLACE SISE A BOULEVARD INDEPENDANCE A BERKANE- PROVINCE DE BERKANE -,MISE A NIVEAU DE LA VILLE DE BERKANE TRAVAUX D’AMENAGEMENT PAYSAGER D’UNE PLACE SISE A BOULEVARD INDEPENDANCE A BERKANE- PROVINCE DE BERKANE -,SOCIETE ALOMRANE REGION DE L’ORIENTAL,BERKANE,2022-08-02,10:00,https://www.marchespublics.gov.ma/?page=entreprise.EntrepriseDetailsConsultation&refConsultation=617913&orgAcronyme=j8k&code=&retraits,Travaux de construction et d’aménagement
33,AOO,Appel d'offres ouvert,Travaux,2022-01-17,4444/2022/SAO,TRAVAUX D’ACHEVEMENT D’AMENAGEMENT DES AXES PRINCIPAUX DE LA VILLE D’AL AIOUN SIDI MELOUK TRANCHE 1 - PROVINCE DE TAOURIRT -,TRAVAUX D’ACHEVEMENT D’AMENAGEMENT DES AXES PRINCIPAUX DE LA VILLE D’AL AIOUN SIDI MELOUK TRANCHE 1 - PROVINCE DE TAOURIRT -,SOCIETE ALOMRANE REGION DE L’ORIENTAL,TAOURIRT,2022-08-02,10:00,https://www.marchespublics.gov.ma/?page=entreprise.EntrepriseDetailsConsultation&refConsultation=617982&orgAcronyme=j8k&code=&retraits,Travaux de construction et d’aménagement
34,AOO,Appel d'offres ouvert,Travaux,2022-01-13,1/2022,TRAVAUX DE MISE A NIVEAU DU CENTRE DE LA COMMUNE DAOURA – PROVINCE DE TARFAYA,TRAVAUX DE MISE A NIVEAU DU CENTRE DE LA COMMUNE DAOURA – PROVINCE DE TARFAYA,Commune rurale de DAOURA,TARFAYA,2022-07-02,11:00,https://www.marchespublics.gov.ma/?page=entreprise.EntrepriseDetailsConsultation&refConsultation=617671&orgAcronyme=b1d&code=&retraits,Travaux de construction et d’aménagement
35,AOO,Appel d'offres ouvert,Travaux,2022-01-17,7/2022,Travaux d'aménagement d'un abattoir à la commune de sidi slimane,Travaux d'aménagement d'un abattoir à la commune de sidi slimane,Commune urbaine de SIDI-SLIMANE,SIDI SLIMANE,2022-07-02,10:30,https://www.marchespublics.gov.ma/?page=entreprise.EntrepriseDetailsConsultation&refConsultation=617858&orgAcronyme=i1t&code=&retraits,Travaux de construction et d’aménagement
36,AOO,Appel d'offres ouvert,Travaux,2022-01-17,7/2021,Travaux d'aménagement d'un abattoir à la commune de sidi slimane,Travaux d'aménagement d'un abattoir à la commune de sidi slimane,Commune urbaine de SIDI-SLIMANE,SIDI SLIMANE,2022-07-02,10:30,https://www.marchespublics.gov.ma/?page=entreprise.EntrepriseDetailsConsultation&refConsultation=617963&orgAcronyme=i1t&code=&retraits,Travaux de construction et d’aménagement
37,AOO,Appel d'offres ouvert,Travaux,2022-01-13,32/2022/apdn,Travaux de confortement et de traitement de l’habitat menaçant ruine à la médina de Tanger (Tranche XI),Travaux de confortement et de traitement de l’habitat menaçant ruine à la médina de Tanger (Tranche XI),AGENCE POUR LA PROMOTION ET LE DEVELOPPEMENT ECONOMIQUE ET SOCIAL DES PREFECTURES ET PROVINCES DU NORD DU ROYAUME,TANGER-ASSILAH,2022-07-02,10:00,https://www.marchespublics.gov.ma/?page=entreprise.EntrepriseDetailsConsultation&refConsultation=617533&orgAcronyme=a1t&code=&retraits,Travaux de construction et d’aménagement
38,AOO,Appel d'offres ouvert,Travaux,2022-01-13,03/22,TRAVAUX DE CONSTRUCTION D’UN POSTE DE POLICE ET D’UN ARRONDISSEMENT SIS A L’OPERATION ALLAIMOUNE COMMUNE DE TIT MELLIL PROVINCE DE MEDIOUNA-LOT UNIQUE,,,"MAROC, MEDIOUNA",2022-07-02,10:00,https://www.marchespublics.gov.ma/?page=entreprise.EntrepriseDetailsConsultation&refConsultation=617591&orgAcronyme=j8k&code=&retraits,Travaux de construction et d’aménagement
39,AOO,Appel d'offres ouvert,Travaux,2022-01-13,22/2022/APDN,"Travaux de traitement de l’environnement de la route non classée reliant la RP4104 et RP4103 via Hamria sur 18,8 km à la commune Zoumi - Province d’Ouezzane","Travaux de traitement de l’environnement de la route non classée reliant la RP4104 et RP4103 via Hamria sur 18,8 km à la commune Zoumi - Province d’Ouezzane",AGENCE POUR LA PROMOTION ET LE DEVELOPPEMENT ECONOMIQUE ET SOCIAL DES PREFECTURES ET PROVINCES DU NORD DU ROYAUME,OUEZZANE,2022-07-02,10:00,https://www.marchespublics.gov.ma/?page=entreprise.EntrepriseDetailsConsultation&refConsultation=617640&orgAcronyme=a1t&code=&retraits,Travaux de construction et d’aménagement
40,AOO,Appel d'offres ouvert,Travaux,2022-01-16,02/2022/ADERFES,"Travaux d’aménagement de la place Arsat Zerb Dans la Médina de Fès, ville de Fès (lot unique).","Travaux d’aménagement de la place Arsat Zerb Dans la Médina de Fès, ville de Fès (lot unique).",AGENCE POUR LE DEVELOPPEMENT ET LA REHABILITATION DE LA VILLE DE FES,FES,2022-07-02,10:00,https://www.marchespublics.gov.ma/?page=entreprise.EntrepriseDetailsConsultation&refConsultation=617801&orgAcronyme=g3h&code=&retraits,Travaux de construction et d’aménagement
41,AOO,Appel d'offres ouvert,Travaux,2022-10-01,01/INDH/2022,TRAVAUX DE CONSTRUCTION DES UNITES DE PRESCOLAIRE A LA PROVINCE DE ZAGORA EN,...,,Province de Zagora,2022-07-02,09:00,https://www.marchespublics.gov.ma/?page=entreprise.EntrepriseDetailsConsultation&refConsultation=617322&orgAcronyme=g3h&code=&retraits,Travaux de construction et d’aménagement
42,AOO,Appel d'offres ouvert,Travaux,2022-10-01,33/2022/apdn,Travaux d’étaiement des habitats menaçant ruine à la médina de Tanger (Tranche II),Travaux d’étaiement des habitats menaçant ruine à la médina de Tanger (Tranche II),AGENCE POUR LA PROMOTION ET LE DEVELOPPEMENT ECONOMIQUE ET SOCIAL DES PREFECTURES ET PROVINCES DU NORD DU ROYAUME,TANGER-ASSILAH,2022-04-02,10:00,https://www.marchespublics.gov.ma/?page=entreprise.EntrepriseDetailsConsultation&refConsultation=617349&orgAcronyme=a1t&code=&retraits,Travaux de construction et d’aménagement
43,AOO,Appel d'offres ouvert,Travaux,2022-12-01,14/2022/apdn,Travaux d’aménagement du lycée et internat IMRABTEN à la province d’Al Hoceima,Travaux d’aménagement du lycée et internat IMRABTEN à la province d’Al Hoceima,AGENCE POUR LA PROMOTION ET LE DEVELOPPEMENT ECONOMIQUE ET SOCIAL DES PREFECTURES ET PROVINCES DU NORD DU ROYAUME,AL HOCEIMA,2022-04-02,10:00,https://www.marchespublics.gov.ma/?page=entreprise.EntrepriseDetailsConsultation&refConsultation=617421&orgAcronyme=a1t&code=&retraits,Travaux de construction et d’aménagement
44,AOO,Appel d'offres ouvert,Travaux,2022-01-13,01/2022/ADERFES,"Travaux de réhabilitation et de restauration des Hammams et de leurs voisinages dans la médina de Fès – ville de Fès, en deux lots séparés :",,,FES,2022-04-02,10:00,https://www.marchespublics.gov.ma/?page=entreprise.EntrepriseDetailsConsultation&refConsultation=617667&orgAcronyme=g3h&code=&retraits,Travaux de construction et d’aménagement
