,procedure,categorie,type_of_work,posting_time,reference,programmme,objet,acheteur_public,lieu_d_execution,date_close,time_close,action,industry
747,AOO,Appel d'offres ouvert,Fournitures,2021-12-20,04/2022,"Acquisition de matériel informatique, licences, matériel technique et audio-visuel en faveur du village d’artisanat                          à la Commune de Foum Zguid Province de Tata","Acquisition de matériel informatique, licences, matériel technique et audio-visuel en faveur du village d’artisanat                          à la Commune de Foum Zguid Province de Tata",REGION de SOUS-MASSA-DRAA,AGADIR IDA OU TANANE,2022-01-20,10:00,https://www.marchespublics.gov.ma/?page=entreprise.EntrepriseDetailsConsultation&refConsultation=614635&orgAcronyme=f9f&code=&retraits,"Matériel et fournitures électriques, électronique, électromécanique et pièces de rechange"
748,AOO,Appel d'offres ouvert,Fournitures,2021-12-28,96/DR2/2021,Acquisition des groupes électropompes de secours pour les centres relevant de l’Agence Mixte d’Al Haouz-Marrakech,Acquisition des groupes électropompes de secours pour les centres relevant de l’Agence Mixte d’Al Haouz-Marrakech,OFFICE NATIONAL DE L'ELECTRICITE ET DE L'EAU POTABLE - BRANCHE EAU,AL HAOUZ,2022-01-20,10:00,https://www.marchespublics.gov.ma/?page=entreprise.EntrepriseDetailsConsultation&refConsultation=615780&orgAcronyme=d4q&code=&retraits,"Matériel et fournitures électriques, électronique, électromécanique et pièces de rechange"
749,AOO,Appel d'offres ouvert,Fournitures,2021-12-29,91/2021/SOREC,FOURNITURE DE CHAUFFE-EAU POUR LE COMPTE DE LA SOREC EN DEUX LOTS SEPARES,...,,"OUJDA-ANGAD, MEKNES, RABAT, KHEMISSET, CASABLANCA, EL JADIDA, NOUACEUR, MARRAKECH",2022-01-20,10:00,https://www.marchespublics.gov.ma/?page=entreprise.EntrepriseDetailsConsultation&refConsultation=615873&orgAcronyme=q1s&code=&retraits,"Matériel et fournitures électriques, électronique, électromécanique et pièces de rechange"
750,AOO,Appel d'offres ouvert,Fournitures,2021-11-16,TC4114935/2021/ONEEBELEC,"Fourniture des transformateurs de mesure 72,5 et 245 kV pour le compte de la Direction Transport Région Centre Casablanca","Fourniture des transformateurs de mesure 72,5 et 245 kV pour le compte de la Direction Transport Région Centre Casablanca",OFFICE NATIONALE DE L'ELECTRICITE ET DE L'EAU POTABLE - BRANCHE ELECTRICITE,CASABLANCA,2022-01-20,09:00,https://www.marchespublics.gov.ma/?page=entreprise.EntrepriseDetailsConsultation&refConsultation=607535&orgAcronyme=d4q&code=&retraits,"Matériel et fournitures électriques, électronique, électromécanique et pièces de rechange"
751,AOO,Appel d'offres ouvert,Fournitures,2021-12-24,DT1113360,Acquisition des casques de protection et des gants de travail pour le compte,...,,MARRAKECH,2022-01-20,09:00,https://www.marchespublics.gov.ma/?page=entreprise.EntrepriseDetailsConsultation&refConsultation=615392&orgAcronyme=d4q&code=&retraits,"Matériel et fournitures électriques, électronique, électromécanique et pièces de rechange"
752,AOO,Appel d'offres ouvert,Fournitures,2021-12-28,03/2022,ACHAT DE FOURNITURES ÉLECTRIQUES A LA COMMUNE  DE TIT MELLIL en lot unique,ACHAT DE FOURNITURES ÉLECTRIQUES A LA COMMUNE  DE TIT MELLIL en lot unique,Commune urbaine de TIT MELLIL,MEDIOUNA,2022-01-19,11:00,https://www.marchespublics.gov.ma/?page=entreprise.EntrepriseDetailsConsultation&refConsultation=615265&orgAcronyme=a1z&code=&retraits,"Matériel et fournitures électriques, électronique, électromécanique et pièces de rechange"
753,AOO,Appel d'offres ouvert,Fournitures,2021-12-24,13/2022/ORSM,"Acquisition de Caméra d’inspection de forage portable à treuil motorisé  pour l’entretien des stations de pompage des périmètres du Souss Massa gérés par l’Office Régional de Mise en Valeur Agricole, Province de","Acquisition de Caméra d’inspection de forage portable à treuil motorisé  pour l’entretien des stations de pompage des périmètres du Souss Massa gérés par l’Office Régional de Mise en Valeur Agricole, Province de TAROUDANT.",OFFICE REGIONAL DE MISE EN VALEUR AGRICOLE DE SOUSS MASSA,TAROUDANNT,2022-01-19,11:00,https://www.marchespublics.gov.ma/?page=entreprise.EntrepriseDetailsConsultation&refConsultation=615409&orgAcronyme=q1s&code=&retraits,"Matériel et fournitures électriques, électronique, électromécanique et pièces de rechange"
754,AOO,Appel d'offres ouvert,Fournitures,2021-12-27,TN2114882/2021/ONEEBELEC,Acquisition de Pièce de rechange Télécom pour la Division exploitation Kenitra : condensateurs d’attaques et boites de couplage.,Acquisition de Pièce de rechange Télécom pour la Division exploitation Kenitra : condensateurs d’attaques et boites de couplage.,OFFICE NATIONALE DE L'ELECTRICITE ET DE L'EAU POTABLE - BRANCHE ELECTRICITE,"Wilaya de Tetouan, Wilaya de Tanger Assilah",2022-01-19,10:30,https://www.marchespublics.gov.ma/?page=entreprise.EntrepriseDetailsConsultation&refConsultation=615605&orgAcronyme=d4q&code=&retraits,"Matériel et fournitures électriques, électronique, électromécanique et pièces de rechange"
755,AOO,Appel d'offres ouvert,Fournitures,2021-12-15,42/POS/2021,"Acquisition des équipements d'un centre multifonctionnel à la commune Bouizakarne ,Province de Guelmim dans le cadre de l’économie sociale et solidaire.","Acquisition des équipements d'un centre multifonctionnel à la commune Bouizakarne ,Province de Guelmim dans le cadre de l’économie sociale et solidaire.",AGENCE POUR LA PROMOTION ET LE DEVELOPPEMENT ECONOMIQUE ET SOCIALE DES PROVINCES DU SUD DU ROYAUME,GUELMIM,2022-01-18,11:00,https://www.marchespublics.gov.ma/?page=entreprise.EntrepriseDetailsConsultation&refConsultation=613643&orgAcronyme=a1t&code=&retraits,"Matériel et fournitures électriques, électronique, électromécanique et pièces de rechange"
756,AOO,Appel d'offres ouvert,Fournitures,2021-12-21,07/2021/IEA/AA,Equipements en moyens de télégestion de la STEP,Equipements en moyens de télégestion de la STEP,OFFICE NATIONAL DE L'ELECTRICITE ET DE L'EAU POTABLE - BRANCHE EAU,RABAT,2022-01-18,10:30,https://www.marchespublics.gov.ma/?page=entreprise.EntrepriseDetailsConsultation&refConsultation=613890&orgAcronyme=d4q&code=&retraits,"Matériel et fournitures électriques, électronique, électromécanique et pièces de rechange"
757,AOO,Appel d'offres ouvert,Fournitures,2021-12-23,004/22/AOO/ONDA,"Fourniture, installation et mise en service d’équipements de réception des données pseudo-radar ADS-B aux aéroports ESSAOUIRA, NADOR et RABAT-SALE.","Fourniture, installation et mise en service d’équipements de réception des données pseudo-radar ADS-B aux aéroports ESSAOUIRA, NADOR et RABAT-SALE.",OFFICE NATIONAL DES AEREPORTS,"MAROC, NADOR, RABAT, SALE, ESSAOUIRA",2022-01-18,10:00,https://www.marchespublics.gov.ma/?page=entreprise.EntrepriseDetailsConsultation&refConsultation=615197&orgAcronyme=o8p&code=&retraits,"Matériel et fournitures électriques, électronique, électromécanique et pièces de rechange"
758,AOO,Appel d'offres ouvert,Fournitures,2021-12-24,121DR6/2021,Acquisition des pièces de rechange électrique pour le Secteur de Production Oujda Taourirt Berkane Nador.,Acquisition des pièces de rechange électrique pour le Secteur de Production Oujda Taourirt Berkane Nador.,OFFICE NATIONAL DE L'ELECTRICITE ET DE L'EAU POTABLE - BRANCHE EAU,"OUJDA-ANGAD, NADOR, BERKANE, TAOURIRT",2022-01-18,09:30,https://www.marchespublics.gov.ma/?page=entreprise.EntrepriseDetailsConsultation&refConsultation=615198&orgAcronyme=d4q&code=&retraits,"Matériel et fournitures électriques, électronique, électromécanique et pièces de rechange"
759,AOO,Appel d'offres ouvert,Fournitures,2021-01-12,TS2115497/2021/25/ONEEBELEC,Fourniture de deux Batteries 127 VCC et d'une batterie navette pour le compte de la Division Exploitation transport Marrakech,Fourniture de deux Batteries 127 VCC et d'une batterie navette pour le compte de la Division Exploitation transport Marrakech,OFFICE NATIONALE DE L'ELECTRICITE ET DE L'EAU POTABLE - BRANCHE ELECTRICITE,MARRAKECH,2022-01-18,09:00,https://www.marchespublics.gov.ma/?page=entreprise.EntrepriseDetailsConsultation&refConsultation=610760&orgAcronyme=d4q&code=&retraits,"Matériel et fournitures électriques, électronique, électromécanique et pièces de rechange"
760,AOO,Appel d'offres ouvert,Fournitures,2021-02-12,TC3115585/2021/ONEEBELEC,Fourniture des graisses et matériels pour le compte de la Direction Transport Région-Centre CASABLANCA,Fourniture des graisses et matériels pour le compte de la Direction Transport Région-Centre CASABLANCA,OFFICE NATIONALE DE L'ELECTRICITE ET DE L'EAU POTABLE - BRANCHE ELECTRICITE,BENI MELLAL,2022-01-18,09:00,https://www.marchespublics.gov.ma/?page=entreprise.EntrepriseDetailsConsultation&refConsultation=610982&orgAcronyme=d4q&code=&retraits,"Matériel et fournitures électriques, électronique, électromécanique et pièces de rechange"
761,AOO,Appel d'offres ouvert,Fournitures,2022-01-17,DAO/CB/MCAM/EW39L/GovM,"Acquisition, Livraison, Installation et Mise en marche des équipements technico-pédagogiques destinés à l’Institut de Formation dans les Métiers du Transport et de la Logistique (IFMTL Nouaceur) bénéficiant de l’appui","Acquisition, Livraison, Installation et Mise en marche des équipements technico-pédagogiques destinés à l’Institut de Formation dans les Métiers du Transport et de la Logistique (IFMTL Nouaceur) bénéficiant de l’appui financier du Fonds Charaka en lot unique :",Acheteur public :,NOUACEUR,2022-02-25,15:00,https://www.marchespublics.gov.ma/?page=entreprise.EntrepriseDetailsConsultation&refConsultation=617831&orgAcronyme=a1t&code=&retraits,"Documentation, manuels, fournitures scolaires et d’enseignement"
762,AOO,Appel d'offres ouvert,Fournitures,2022-01-17,EW39K,"Acquisition, Livraison, Installation et Mise en marche des équipements technico-pédagogiques destinés aux instituts de formation professionnelle bénéficiant de l’appui financier du Fonds Charaka en 13 lots","Acquisition, Livraison, Installation et Mise en marche des équipements technico-pédagogiques destinés aux instituts de formation professionnelle bénéficiant de l’appui financier du Fonds Charaka en 13 lots",AGENCE MCA-MOROCCO,"FAHS-ANJRA, OUJDA-ANGAD, MEKNES, BENI MELLAL, CASABLANCA, NOUACEUR, BERRECHID",2022-02-22,15:00,https://www.marchespublics.gov.ma/?page=entreprise.EntrepriseDetailsConsultation&refConsultation=617864&orgAcronyme=a1t&code=&retraits,"Documentation, manuels, fournitures scolaires et d’enseignement"
763,AOO,Appel d'offres ouvert,Fournitures,2022-05-01,10/2022/apdn,L’ACQUISITION DE MOBILIER D’ENSEIGNEMENT POUR LES CLASSES DE PRESCOLAIRE AU PROFIT DES DIFFERENTS ETABLISSEMENTS SCOLAIRES RELEVANT DE L’AREF TANGER TETOUAN- AL HOCEIMA.,,,"TANGER-ASSILAH, MDIQ-FNIDEQ, TETOUAN, FAHS-ANJRA, LARACHE, AL HOCEIMA, CHEFCHAOUEN, OUEZZANE",2022-01-28,10:00,https://www.marchespublics.gov.ma/?page=entreprise.EntrepriseDetailsConsultation&refConsultation=616854&orgAcronyme=a1t&code=&retraits,"Documentation, manuels, fournitures scolaires et d’enseignement"
764,AOO,Appel d'offres ouvert,Fournitures,2021-12-15,42/POS/2021,"Acquisition des équipements d'un centre multifonctionnel à la commune Bouizakarne ,Province de Guelmim dans le cadre de l’économie sociale et solidaire.","Acquisition des équipements d'un centre multifonctionnel à la commune Bouizakarne ,Province de Guelmim dans le cadre de l’économie sociale et solidaire.",AGENCE POUR LA PROMOTION ET LE DEVELOPPEMENT ECONOMIQUE ET SOCIALE DES PROVINCES DU SUD DU ROYAUME,GUELMIM,2022-01-18,11:00,https://www.marchespublics.gov.ma/?page=entreprise.EntrepriseDetailsConsultation&refConsultation=613643&orgAcronyme=a1t&code=&retraits,"Documentation, manuels, fournitures scolaires et d’enseignement"
765,AOO,Appel d'offres ouvert,Fournitures,2022-08-01,02/2022/ISMAC,Fournitures et l’installation des équipements techniques et audiovisuels à L’Institut Supérieur des Métiers de l’Audiovisuel et du Cinéma,Fournitures et l’installation des équipements techniques et audiovisuels à L’Institut Supérieur des Métiers de l’Audiovisuel et du Cinéma,INSTITUT SUPERIEUR DES METIERS DE L'AUDIO-VISUEL ET DU CINEMA,RABAT,2022-02-24,10:00,https://www.marchespublics.gov.ma/?page=entreprise.EntrepriseDetailsConsultation&refConsultation=617089&orgAcronyme=x6c&code=&retraits,"Matériel technique, de lutte contre l’incendie et pièces de rechange"
766,AOO,Appel d'offres ouvert,Fournitures,2022-10-01,TC4115559/2022/ONEEBELEC,Achat des équipements de protection collectif et individuel pour le compte de la Direction Transport Région Centre Casablanca.,Achat des équipements de protection collectif et individuel pour le compte de la Direction Transport Région Centre Casablanca.,OFFICE NATIONALE DE L'ELECTRICITE ET DE L'EAU POTABLE - BRANCHE ELECTRICITE,CASABLANCA,2022-02-17,09:00,https://www.marchespublics.gov.ma/?page=entreprise.EntrepriseDetailsConsultation&refConsultation=617331&orgAcronyme=d4q&code=&retraits,"Matériel technique, de lutte contre l’incendie et pièces de rechange"
767,AOO,Appel d'offres ouvert,Fournitures,2021-06-12,AS3110840, ACQUISITION DU MATERIEL POUR LA MISE A NIVEAU,...,,"MAROC, CASABLANCA",2022-02-16,09:00,https://www.marchespublics.gov.ma/?page=entreprise.EntrepriseDetailsConsultation&refConsultation=610443&orgAcronyme=d4q&code=&retraits,"Matériel technique, de lutte contre l’incendie et pièces de rechange"
768,AOO,Appel d'offres ouvert,Fournitures,2022-01-14,02/BP/2022,Acquisition d’un moulin de céréales  au profit de la Coop MATHANAT GRART  LABACH,Acquisition d’un moulin de céréales  au profit de la Coop MATHANAT GRART  LABACH,Province de  ASSA-ZAG,ASSA-ZAG,2022-10-02,12:30,https://www.marchespublics.gov.ma/?page=entreprise.EntrepriseDetailsConsultation&refConsultation=617699&orgAcronyme=m8x&code=&retraits,"Matériel technique, de lutte contre l’incendie et pièces de rechange"
769,AOO,Appel d'offres ouvert,Fournitures,2021-12-21,63/DRG/CA/I/2021,"Acquisition du matériel de sécurité  assainissement pour les centres de Taghjijt, Mirleft et EL ouatia","Acquisition du matériel de sécurité  assainissement pour les centres de Taghjijt, Mirleft et EL ouatia",OFFICE NATIONAL DE L'ELECTRICITE ET DE L'EAU POTABLE - BRANCHE EAU,GUELMIM,2022-03-02,10:00,https://www.marchespublics.gov.ma/?page=entreprise.EntrepriseDetailsConsultation&refConsultation=613869&orgAcronyme=d4q&code=&retraits,"Matériel technique, de lutte contre l’incendie et pièces de rechange"
770,AOO,Appel d'offres ouvert,Fournitures,2021-12-21,64/DRG/CA/I/2021,"Acquisition du matériel d'entretien et d'exploitation  assainissement pour les centres de Taghjijt, Mirleft et EL ouatia","Acquisition du matériel d'entretien et d'exploitation  assainissement pour les centres de Taghjijt, Mirleft et EL ouatia",OFFICE NATIONAL DE L'ELECTRICITE ET DE L'EAU POTABLE - BRANCHE EAU,GUELMIM,2022-03-02,10:00,https://www.marchespublics.gov.ma/?page=entreprise.EntrepriseDetailsConsultation&refConsultation=613870&orgAcronyme=d4q&code=&retraits,"Matériel technique, de lutte contre l’incendie et pièces de rechange"
771,AOO,Appel d'offres ouvert,Travaux,2022-05-01,03/SAP/SP.IM/2022,"L’ACHAT, LE POSE ET L’INSTALLATION DES EXTINCTEURS AUX DIFFERENTS LOCAUX DE POLICE RELEVANT DE LA PREFECTURE DE POLICE DE BENI MELLAL. -lot unique-","L’ACHAT, LE POSE ET L’INSTALLATION DES EXTINCTEURS AUX DIFFERENTS LOCAUX DE POLICE RELEVANT DE LA PREFECTURE DE POLICE DE BENI MELLAL. -lot unique-",CHEF DE LA SURETE DE BENIMELLAL,"BENI MELLAL, AZILAL, FQUIH BEN SALAH, KHENIFRA, KHOURIBGA",2022-03-02,10:00,https://www.marchespublics.gov.ma/?page=entreprise.EntrepriseDetailsConsultation&refConsultation=616955&orgAcronyme=g3h&code=&retraits,"Matériel technique, de lutte contre l’incendie et pièces de rechange"
772,AOO,Appel d'offres ouvert,Fournitures,2021-12-30,36/2021/CTSA/F,"Fourniture, Installation et maintenance d’une Centrale Solaire Photovoltaïque au niveau du Centre de Maintenance des Bus à Haut Niveau de Service (BHNS) De Ouled Azzouz","Fourniture, Installation et maintenance d’une Centrale Solaire Photovoltaïque au niveau du Centre de Maintenance des Bus à Haut Niveau de Service (BHNS) De Ouled Azzouz",CASABLANCA TRANSPORT EN SITE AMENAGE SA,NOUACEUR,2022-01-02,10:00,https://www.marchespublics.gov.ma/?page=entreprise.EntrepriseDetailsConsultation&refConsultation=616096&orgAcronyme=g3h&code=&retraits,"Matériel technique, de lutte contre l’incendie et pièces de rechange"
773,AOO,Appel d'offres ouvert,Fournitures,2022-10-01,02/2022/OFPPT,"l’Acquisition, installation et mise en service des équipements de secteur génie électrique destinés aux Cités des métiers et des Compétences répartie en lots suivants :",,Lot n° 3 : Bancs Pneumatiques et Hydrauliques,"TANGER-ASSILAH, FES, RABAT, BENI MELLAL, MARRAKECH, ERRACHIDIA",2022-01-02,10:00,https://www.marchespublics.gov.ma/?page=entreprise.EntrepriseDetailsConsultation&refConsultation=617210&orgAcronyme=o4d&code=&retraits,"Matériel technique, de lutte contre l’incendie et pièces de rechange"
774,AOO,Appel d'offres ouvert,Fournitures,2021-12-15,68/BR/RGON/2021,"FOURNITURE, INSTALLATION ET MISE EN SERVICE DES EQUIPEMENTS DU SYSTEME DE SONORISATION ET MOBILIERS DES SALLES DE REUNION ET D'ACCUEIL DU SIEGE DE LA REGION GUELMIM OUED NOUN EN LOT UNIQUE","FOURNITURE, INSTALLATION ET MISE EN SERVICE DES EQUIPEMENTS DU SYSTEME DE SONORISATION ET MOBILIERS DES SALLES DE REUNION ET D'ACCUEIL DU SIEGE DE LA REGION GUELMIM OUED NOUN EN LOT UNIQUE",REGION DE GUELMIM - OUED NOUN,GUELMIM,2022-01-21,11:00,https://www.marchespublics.gov.ma/?page=entreprise.EntrepriseDetailsConsultation&refConsultation=613564&orgAcronyme=m8x&code=&retraits,"Matériel technique, de lutte contre l’incendie et pièces de rechange"
775,AOO,Appel d'offres ouvert,Travaux,2021-12-13,13/DDE/DPP/2021,"l’acquisition et les travaux d’installation de systèmes de vidéosurveillance, de contrôle d’accès et de détection d’incendie destinés aux Services Déconcentrés de la Direction des Domaines de l'Etat, en lot unique","l’acquisition et les travaux d’installation de systèmes de vidéosurveillance, de contrôle d’accès et de détection d’incendie destinés aux Services Déconcentrés de la Direction des Domaines de l'Etat, en lot unique",DIRECTEUR DES DOMAINES,"LARACHE, BERKANE, MEKNES, TAOUNATE, RABAT, SALE, KENITRA, KHEMISSET, BENI MELLAL, KHENIFRA, KHOURIBGA, CASABLANCA, NOUACEUR, SETTAT, EL KELAA DES SRAGHNA, OUARZAZATE, TAROUDANNT, TIZNIT, OUED ED DAHAB",2022-01-20,10:30,https://www.marchespublics.gov.ma/?page=entreprise.EntrepriseDetailsConsultation&refConsultation=613185&orgAcronyme=g8e&code=&retraits,"Matériel technique, de lutte contre l’incendie et pièces de rechange"
776,AOO,Appel d'offres ouvert,Fournitures,2021-12-26,07/2021/DRPS/OFPPT,vente des équipements reformés par les établissements de formation relevant de la Direction Régionale des provinces du Sud /OFPPT,vente des équipements reformés par les établissements de formation relevant de la Direction Régionale des provinces du Sud /OFPPT,OFPPT/DIRECTION REGIONALE DES PROVINCES DU SUD,"GUELMIM, ASSA-ZAG, TAN-TAN, LAAYOUNE",2022-01-20,10:00,https://www.marchespublics.gov.ma/?page=entreprise.EntrepriseDetailsConsultation&refConsultation=615552&orgAcronyme=o4d&code=&retraits,"Matériel technique, de lutte contre l’incendie et pièces de rechange"
777,AOO,Appel d'offres ouvert,Travaux,2021-02-12,GN4112962/DXG/2021,"Prestation d’épreuve des appareils sous pression de gaz et des bouteilles de protection incendie CO2 des centrales TAG de Mohammedia 3x100 MW, Mohammedia 3x33MW et Tit Mellil","Prestation d’épreuve des appareils sous pression de gaz et des bouteilles de protection incendie CO2 des centrales TAG de Mohammedia 3x100 MW, Mohammedia 3x33MW et Tit Mellil",OFFICE NATIONALE DE L'ELECTRICITE ET DE L'EAU POTABLE - BRANCHE ELECTRICITE,"MOHAMMADIA, MEDIOUNA",2022-01-20,09:00,https://www.marchespublics.gov.ma/?page=entreprise.EntrepriseDetailsConsultation&refConsultation=611036&orgAcronyme=d4q&code=&retraits,"Matériel technique, de lutte contre l’incendie et pièces de rechange"
778,AOO,Appel d'offres ouvert,Fournitures,2021-12-27,02./2022,ACHAT DE MATÉRIEL DE JARDINAGE POUR LES ESPACES VERTS DE LA COMMUNE DE TIT MELLIL,,,MEDIOUNA,2022-01-18,11:00,https://www.marchespublics.gov.ma/?page=entreprise.EntrepriseDetailsConsultation&refConsultation=615254&orgAcronyme=a1z&code=&retraits,"Matériel technique, de lutte contre l’incendie et pièces de rechange"
779,AOO,Appel d'offres ouvert,Fournitures,2022-12-01,01/2022/DA/CS/PRG/INH/DELM,"  ACHAT DES REACTIFS A USAGE DE DIAGNOSTIC IN VITRO, PRODUITS CHIMIQUES, CONSOMMABLES MEDICAUX ET DISPOSITIFS MEDICAUX DESTINES AUX PROGRAMMES SANITAIRES DE LA DIRECTION DE L’EPIDEMIOLOGIE ET DE LUTTE CONTRE LES MALADIES Et A","  ACHAT DES REACTIFS A USAGE DE DIAGNOSTIC IN VITRO, PRODUITS CHIMIQUES, CONSOMMABLES MEDICAUX ET DISPOSITIFS MEDICAUX DESTINES AUX PROGRAMMES SANITAIRES DE LA DIRECTION DE L’EPIDEMIOLOGIE ET DE LUTTE CONTRE LES MALADIES Et A l’INSTITUT NATIONAL D’HYGIENE",CHEF DE DIVISION DE L'APPROVISIONEMENT -RABAT-,"CASABLANCA, BERRECHID",2022-02-24,09:30,https://www.marchespublics.gov.ma/?page=entreprise.EntrepriseDetailsConsultation&refConsultation=617451&orgAcronyme=q9t&code=&retraits,"Equipements et produits médicaux, pharmaceutiques et de laboratoire"
780,AOO,Appel d'offres ouvert,Fournitures,2022-04-01,18/2021,Fourniture des gaz à usage médical  destinés au CHP My Rachid  relevant de la préfecture des arrondissements Moulay Rachid de Casablanca en LOT Unique.,Fourniture des gaz à usage médical  destinés au CHP My Rachid  relevant de la préfecture des arrondissements Moulay Rachid de Casablanca en LOT Unique.,CECENTRE HOSPITALIER PREFECTORAL DES ARRONDISSEMENTS MOULAY RCHID DE CASABLANCA,CASABLANCA,2022-02-17,10:00,https://www.marchespublics.gov.ma/?page=entreprise.EntrepriseDetailsConsultation&refConsultation=610296&orgAcronyme=q9t&code=&retraits,"Equipements et produits médicaux, pharmaceutiques et de laboratoire"
781,AOO,Appel d'offres ouvert,Fournitures,2022-01-13,04/BP/2022,ACQUISITION ET MONTAGE DU MATERIEL ET MOBILIER MEDICAL AU PROFIT DES FORMATIONS SANITAIRES RURALES RELEVANT DE LA DELEGATION DE LA SANTE DE OUARZAZATE : (CSR2 ASDIF CSR1 AGUIM CSR1 AMZRI DR ASSAKA ET DR IMDRI),ACQUISITION ET MONTAGE DU MATERIEL ET MOBILIER MEDICAL AU PROFIT DES FORMATIONS SANITAIRES RURALES RELEVANT DE LA DELEGATION DE LA SANTE DE OUARZAZATE : (CSR2 ASDIF CSR1 AGUIM CSR1 AMZRI DR ASSAKA ET DR IMDRI),Province de  OUARZAZATE,Province d'Ouarzazate,2022-02-15,10:00,https://www.marchespublics.gov.ma/?page=entreprise.EntrepriseDetailsConsultation&refConsultation=617572&orgAcronyme=f9f&code=&retraits,"Equipements et produits médicaux, pharmaceutiques et de laboratoire"
782,AOO,Appel d'offres ouvert,Fournitures,2022-01-14,01/2022/BP/PFG,"Equipement médicaux et biomédicaux des centres de santé   aux centres  Aboulakhal, Ain chair et Bouanane et dispensaires  rurales à Trarid relevant de la Commune Tendrara , Ait Idir et chaib relevant de la Commune de Talsint","Equipement médicaux et biomédicaux des centres de santé   aux centres  Aboulakhal, Ain chair et Bouanane et dispensaires  rurales à Trarid relevant de la Commune Tendrara , Ait Idir et chaib relevant de la Commune de Talsint et Gusirat relevant de la Commune de Bouchaouene à la Province de Figuig",Province de  FIGUIG,FIGUIG,2022-09-02,11:30,https://www.marchespublics.gov.ma/?page=entreprise.EntrepriseDetailsConsultation&refConsultation=617695&orgAcronyme=f8y&code=&retraits,"Equipements et produits médicaux, pharmaceutiques et de laboratoire"
783,AOO,Appel d'offres ouvert,Fournitures,2022-01-14,02/2022/BP/PFG,Equipement d’une unité mobile en matériel de santé scolaire,,,FIGUIG,2022-09-02,10:30,https://www.marchespublics.gov.ma/?page=entreprise.EntrepriseDetailsConsultation&refConsultation=617700&orgAcronyme=f8y&code=&retraits,"Equipements et produits médicaux, pharmaceutiques et de laboratoire"
784,AOO,Appel d'offres ouvert,Fournitures,2022-06-01,01/2022/chp,"Achat de fongibles afférents à la radiologie pour le Centre Hospitalier Provincial de Taza, Province de Taza.","Achat de fongibles afférents à la radiologie pour le Centre Hospitalier Provincial de Taza, Province de Taza.",CENTRE HOSPITALIER PROVINCIAL DE TAZA,TAZA,2022-04-02,10:00,https://www.marchespublics.gov.ma/?page=entreprise.EntrepriseDetailsConsultation&refConsultation=616979&orgAcronyme=q9t&code=&retraits,"Equipements et produits médicaux, pharmaceutiques et de laboratoire"
785,AOO,Appel d'offres ouvert,Fournitures,2021-12-31,79/DR8/C/2021,Acquisition des appareils scientifiques pour les laboratoires relevant de la Direction Régionale des Provinces Sahariennes,Acquisition des appareils scientifiques pour les laboratoires relevant de la Direction Régionale des Provinces Sahariennes,OFFICE NATIONAL DE L'ELECTRICITE ET DE L'EAU POTABLE - BRANCHE EAU,"LAAYOUNE, BOUJDOUR, TARFAYA, ES-SEMARA, OUED ED DAHAB, AOUSSERD",2022-03-02,10:00,https://www.marchespublics.gov.ma/?page=entreprise.EntrepriseDetailsConsultation&refConsultation=616453&orgAcronyme=d4q&code=&retraits,"Equipements et produits médicaux, pharmaceutiques et de laboratoire"
